5559	538	Отрада (1 очередь)	Московская область	Московская область, городской округ Красногорск, поселок Отрадное
5571	539	Академический	Московская область	Московская область, Люберцы, Инициативная улица, 13
5576	540	Солнечная система	Московская область	Московская область, Химки, улица Германа Титова
5577	541	Лобачевский	Москва	Москва, улица Лобачевского
5589	542	по ул. Евстафьева, д. 1/9 (мкр. 28)	Московская область	Московская область, Балашиха, улица Евстафьева
5590	543	Балашиха, ул. Шоссе Энтузиастов, д. 5Б	Московская область	Московская область, Балашиха, шоссе Энтузиастов, 5Б
5600	544	Раменское, Микрорайон №5	Московская область	Московская область, Раменское, улица Чугунова
5609	545	Финский	Московская область	Московская область, Щёлково, микрорайон Финский
5631	546	Эталон-Сити	Москва	Москва, Старокрымская улица
5640	547	Южное Видное	Московская область	Московская область, Ленинский район, Видное, Берёзовая улица
5641	548	Лайнер	Москва	Москва, Ходынский бульвар
5683	549	Менделеев	Московская область	Московская область, Химки, Молодёжная улица, 78
5684	550	Внуково Парк	Москва	Москва, поселение Марушкинское, деревня Марушкино, Агрохимическая улица
5686	551	Микрорайон Лобня Сити	Московская область	Московская область, Лобня, улица Борисова
5687	552	Лидер Парк	Московская область	Московская область, Мытищи, шоссе Волковское
5693	553	Ново-Никольское	Москва	Москва, поселение Первомайское
5783	554	Подсолнухи	Москва	Москва, улица Твардовского, 2к4
5787	555	Донской Олимп	Москва	Москва, улица Серпуховский Вал
5788	556	Левитан	Московская область	Московская область, Красногорск, Советская улица, 1
5789	557	Радужный	Московская область	Московская область, Ленинский район, Видное, Битцевский проезд
5792	558	Новое Бутово	Москва	Москва, Чечерский проезд
5793	559	Белый парк	Москва	Москва, Беломорская улица, 18Ак2
5794	560	Новые Ватутинки. Микрорайон Центральный	Москва	Москва, поселение Десёновское, 2-я Нововатутинская улица
5795	561	Марьино Град	Москва	Москва, поселение Филимонковское, жилой комплекс Марьино Град
5799	562	Форт Сколково	Московская область	Московская область, Одинцовский район, рабочий посёлок Заречье, Каштановая улица, 1
5802	563	Западная Долина	Москва	Москва, поселение Марушкинское, деревня Большое Свинорье, коттеджный поселок Западная Долина
5804	564	Квартал 9-18	Московская область	Московская область, Мытищи, Летная улица
5805	565	Малина	Московская область	Московская область, городской округ Красногорск, рабочий посёлок Нахабино, Покровская улица
5808	566	улица Трудовая	Московская область	Московская область, Мытищи, Трудовая улица, 22
5809	567	RedSide	Москва	Москва, улица Сергея Макеева, 9
5810	568	Дом в Лавровом переулке	Москва	Москва, Лавров переулок, 8с1
5812	569	Малая Истра	Московская область	Московская область, городской округ Истра, деревня Высоково, микрорайон Малая Истра
5813	570	Проспект Красной Армии 251а	Московская область	Московская область, Сергиев Посад, проспект Красной Армии, 251А
5814	571	На Первомайской	Московская область	Московская область, Пушкино, Первомайская улица, 3А
5815	572	Набережная 2А	Московская область	Московская область, Пушкино, Набережная улица
5816	573	Чайковского 20	Московская область	Московская область, Сергиев Посад, улица Чайковского
5817	574	Зодиак	Москва	Москва, Сосновая аллея, 1
5818	575	Эко Видное	Московская область	Московская область, Ленинский район, деревня Сапроново, микрорайон Эко Видное
5820	576	Лужники Хаус	Москва	Москва, улица Хамовнический Вал, 36
5821	577	Экодолье Шолохово	Московская область	Московская область, городской округ Мытищи, деревня Шолохово, улица Экодолье
5822	578	МФК IQ-квартал	Москва	Москва, Пресненская набережная, 11
5824	579	Клубный дом на Смоленском бульваре	Москва	Москва, Смоленский бульвар, 24к3
5825	580	Проспект Красной Армии 247	Московская область	Московская область, Сергиев Посад, проспект Красной Армии
5826	581	Проспект Красной Армии 253а	Московская область	Московская область, Сергиев Посад, проспект Красной Армии
5827	582	Даниловская мануфактура	Москва	Москва, Варшавское шоссе, 9С1
5829	583	На ул. Дубки (Мкр. Юго-Восточный)	Московская область	Московская область, Наро-Фоминский городской округ, Апрелевка, улица Дубки
5830	584	Валентиновка парк	Московская область	Московская область, Королев, улица Горького, 79
5831	585	Клубный дом Печатников	Москва	Москва, переулок Печатников, 3С1
5832	586	Азовский-2	Москва	Москва, Азовская улица, 24К2
5835	587	Серебрянка	Московская область	Московская область, Пушкино, микрорайон Серебрянка, 48
5838	588	Бутовские аллеи	Москва	Москва, посёлок Коммунарка, улица Потаповская Роща
5839	589	Видный	Московская область	Московская область, Ленинский район, Видное, территория жилой комплекс Видный, Белокаменное шоссе, 5
5841	590	Мкр. 8 Юбилейный пр-т	Московская область	Московская область, Реутов, Юбилейный проспект
5842	591	Восточное Бутово	Московская область	Московская область, Ленинский район, деревня Боброво, Лесная улица
5843	592	Рождественский	Московская область	Московская область, Мытищи, Рождественская улица
5845	593	Шатер	Москва	Москва, Верхняя Красносельская улица, 19с2
5846	594	Щербинка, ул. Садовая	Москва	Москва, Щербинка, Садовая улица, 9
5847	595	Заречный	Московская область	Московская область, городской округ Люберцы, деревня Марусино, Заречная улица
5866	596	на ул. Стрелковая	Московская область	Московская область, Мытищинский район, Мытищи городской округ, Мытищи, ул. Стрелковая
5867	597	Ильинская Слобода	Московская область	Московская область, Раменский район, посёлок городского типа Ильинский, улица Наты Бабушкиной
5868	598	Бутово парк	Московская область	Московская область, Ленинский район, сельское поселение Булатниковское, деревня Бутово, жилой комплекс Бутово Парк
5869	599	Заречная 4	Московская область	Московская область, Щёлково, Заречная улица, 8к2
5870	600	Южное Кучино 2	Московская область	Московская область, город Железнодорожный, Речная улица
5871	601	Мкр. 9А	Московская область	Московская область, Реутов, Юбилейный проспект
5872	602	Победы 15	Московская область	Московская область, Реутов, улица Победы
5873	603	Лесная 11	Московская область	Московская область, Реутов, Лесная улица
5874	604	Реутов, ул. Победы, д.28	Московская область	Московская область, Реутов, улица Победы, 28
5875	605	Катюшки 2	Московская область	Московская область, Лобня, улица Юности
5876	606	Мосфильмовская	Москва	Москва, Мосфильмовская улица, 74Б
5877	607	Новомосковский	Москва	Москва, Щербинка, Овражная улица
5880	608	Дом на ул. Чайковского	Московская область	Московская область, Лобня, улица Чайковского, 25
5881	609	На ул. Бориса Жигуленкова	Москва	Москва, улица Бориса Жигуленкова
5882	610	Щитниково Янтарный	Московская область	Московская область, Балашиха, микрорайон Янтарный
5883	611	Микрорайон «1 Мая»	Московская область	Московская область, Балашиха, микрорайон 1 Мая
5884	612	На ул. Лечебная	Москва	Москва, Лечебная улица
5885	613	На Юбилейной	Московская область	Московская область, Железнодорожный, Юбилейная улица
5886	614	Северное Кучино	Московская область	Московская область, Балашиха, микрорайон Кучино, улица Лесные Поляны
5887	615	Южное Кучино	Московская область	Московская область, Балашиха, микрорайон Кучино, Речная улица
5888	616	Дом на Пролетарском проспекте	Московская область	Московская область, Щёлково, Пролетарский проспект
5889	617	Юбилейный	Московская область	Московская область, Химки, улица Горшина, 10
5892	618	Утесов	Москва	Москва, Карамышевская набережная, к2
5894	619	Barrin House	Москва	Москва, Малая Пироговская улица
5895	620	Сердце Столицы	Москва	Москва, улица Шеногина
5896	621	Две башни	Москва	Москва, улица Маршала Бирюзова, 32К1
5899	622	Парковый	Московская область	Московская область, Подольск, улица Ульяновых, 31
5900	623	Филипповский	Москва	Москва, Филипповский переулок, 8с1
5901	624	Маршала Бирюзова, 31-33	Москва	Москва, улица Маршала Конева, 14
5902	625	Южная долина	Московская область	Московская область, Ленинский район, поселок Мещерино, микрорайон Южные Горки
5904	626	Маршала Василевского	Москва	Москва, улица Маршала Василевского, 13К3
5905	627	Новая звезда	Москва	Москва, улица Расплетина, 14
5906	628	Маршала Новикова, 12	Москва	Москва, улица Маршала Новикова, 12
5909	629	Тепличный переулок, 4	Москва	Москва, Тепличный переулок, 4
5910	630	Ирины Левченко, 1	Москва	Москва, улица Ирины Левченко, 1
5911	631	Авиационная, 59-63	Москва	Москва, Авиационная улица, 59
5913	632	Авиационная, 66	Москва	Москва, Авиационная улица, 66
5914	633	Маршала Соколовского, 1	Москва	Москва, улица Маршала Соколовского, 1
5915	634	Новое Медведково	Московская область	Московская область, Мытищи, проспект Астрахова
5916	635	Павшино-БЭСТ	Московская область	Московская область, Красногорск, микрорайон Павшинская Пойма, улица имени Головкина
5918	636	Московские водники	Московская область	Московская область, Долгопрудный, Набережная улица
5919	637	Крылатский	Москва	Москва, Рублёвское шоссе
5920	638	Зелёная роща	Московская область	Московская область, Ивантеевка, Санаторная улица, 1к1
5921	639	Прибрежный	Московская область	Московская область, Красногорск, Красногорский бульвар
5924	640	Ривьера Парк	Московская область	Московская область, Подольск, Парковая улица, 3
5925	641	БЭСТ-квартиры в Северном Бутово	Москва	Москва, Старокачаловская улица
5926	642	БЭСТ-квартиры в Новопеределкино	Москва	Москва, улица Скульптора Мухиной, 1
5928	643	Дом на Зеленой	Московская область	Московская область, Люберцы, Новая улица, 9
5931	644	Театральный Дом	Москва	Москва, Поварская улица
5932	645	Рациональ	Московская область	Московская область, Реутов, улица Головашкина
5934	646	Мкр. Западный	Московская область	Московская область, Домодедово, улица Текстильщиков
5946	647	Vesna	Московская область	Московская область, Наро-Фоминский район, Апрелевка, Ясная улица
5949	648	Ньютон	Московская область	Московская область, Мытищи, улица Рождественская, 11
5950	649	Парк Рублево	Московская область	Московская область, городской округ Красногорск, жилой комплекс Парк Рублёво, улица Согласия
5968	650	Павловский квартал	Московская область	Московская область, городской округ Истра, деревня Лобаново, жилой комплекс Павловский квартал, Новая улица
5969	651	Павлово	Московская область	Московская область, городской округ Истра, деревня Веледниково, коттеджный поселок Павлово
5991	652	Жемчужина Виктории	Московская область	Московская область, Балашиха, проспект Ленина
5992	653	Панорама Сколково	Московская область	Московская область, Одинцовский район, рабочий посёлок Новоивановское, улица Агрохимиков, 15А
6004	654	Кронбург	Москва	Москва, поселение Воскресенское, деревня Губкино, коттеджный поселок Кронбург
6007	655	Фестиваль	Москва	Москва, поселение Сосенское, коттеджный посёлок Фестиваль
6008	656	Николино	Москва	Москва, поселение Сосенское, Николо-Хованская улица
6011	657	Белый Город	Московская область	Московская область, Солнечногорский район, деревня Николо-Черкизово, микрорайон Белый Город
6013	658	Приволье	Москва	Москва, Привольная улица, 56
6019	659	Некрасовский	Московская область	Московская область, городской округ Мытищи, посёлок Трудовая, Шоссейная улица
6027	660	Молодежный (Красногорск)	Московская область	Московская область, Красногорск, Молодёжная улица
6033	661	Центр+ (Центр плюс)	Московская область	Московская область, Балашиха, Железнодорожный, Автозаводская улица
6036	662	Супонево	Московская область	Московская область, Звенигород, микрорайон Супонево
6048	663	Гелиос	Московская область	Московская область, Химки, улица Академика Грушина, 4
6076	664	Леоновский парк	Московская область	Московская область, Балашиха, микрорайон Кучино, улица Соловьева
6111	665	Декарт	Московская область	Московская область, Мытищи, улица Колпакова, 41
6113	666	Мелодия леса	Московская область	Московская область, Солнечногорский район, д. Голубое, улица Родниковая
6114	667	Лесной дом	Москва	Москва, Новолесная улица, 4
6116	668	Маяк	Московская область	Московская область, Химки, улица Кудрявцева
6117	669	Яуза Парк	Москва	Москва, Краснобогатырская улица, 24
6118	670	Домодедовский	Московская область	Московская область, Домодедово, улица Курыжова
6126	671	Зелёная Линия	Москва	Москва, посёлок Коммунарка, Александры монаховой
6127	672	Москва А101	Москва	Москва, посёлок Коммунарка, улица Липовый Парк
6130	673	Люберцы 2015	Московская область	Московская область, Люберцы, Вертолётная улица
6134	674	Наследие	Москва	Москва, Краснобогатырская улица
6135	675	Ёлкино	Московская область	Московская область, Солнечногорский район, деревня Елино
6139	676	Кристалл	Москва	Москва, Смольная улица, 49
6145	677	Апарт-отель YE’S	Москва	Москва, Митинская улица, дом 16
6151	678	Виват Чехов	Московская область	Московская область, Чехов, Лопасненская улица
6152	679	Альфа Центавра	Московская область	Московская область, Химки, 9 Мая улица
6159	680	Центральный	Московская область	Московская область, Железнодорожный, улица Маяковского
6176	681	Сходня Парк	Московская область	Московская область, Химки, Первомайская улица
6178	682	Ривер Парк	Москва	Москва, Корабельная улица
6179	683	Рублевские Огни	Москва	Москва, Рублёвское шоссе, 107
6180	684	Люберецкий	Московская область	Московская область, Люберцы, улица Гоголя
6181	685	Пролетарский проспект 12	Московская область	Московская область, Щелково, Пролетарский проспект, 12
6182	686	Штаб-Квартира	Московская область	Московская область, Балашиха, микрорайон 1 Мая, 27
6183	687	На ул. Юбилейная	Московская область	Московская область, Железнодорожный, Юбилейная улица
6185	688	Люмьер	Москва	Москва, 1-й Самотёчный переулок, вл17Б
6186	689	Молодежный (Голицыно)	Московская область	Московская область, Одинцовский район, Голицыно, бульвар Генерала Ремезова, 10
6188	690	Русский модерн	Москва	Москва, Гоголевский бульвар, 29
6190	691	Квартал апартаментов Искра-Парк	Москва	Москва, Ленинградский проспект
6191	692	Изумрудная долина III	Москва	Москва, Рублевское шоссе, 111
6192	693	Изумрудная долина I	Москва	Москва, Ельнинская улица, 15к3
6193	694	Изумрудная долина II	Москва	Москва, Ярцевская улица, 27А
6195	695	Crystal-House	Москва	Москва, переулок Коробейников, 1
6196	696	Коппер Хаус	Москва	Москва, Бутиковский переулок
6197	697	Молочный 1	Москва	Москва, Молочный переулок, 1
6198	698	Зачатьевский 19-21	Москва	Москва, Хамовники
6199	699	Ивакино-Покровское	Московская область	Московская область, Химки, микрорайон Клязьма-Старбеево, квартал Международный, квартал Ивакино-Покровское
6201	700	Квартал А101	Москва	Москва, посёлок Коммунарка, Ясная улица
6203	701	Резиденции Композиторов (AFI Residence Павелецкая)	Москва	Москва, Павелецкая набережная
6204	702	Чехова, корп. 16	Московская область	Московская область, Богородский городской округ, Старая Купавна, улица Чехова
6205	703	Одинцово, мкр. 8	Московская область	Московская область, Одинцово, 8-й микрорайон
6207	704	Мытищи, мкр. 24	Московская область	Московская область, Мытищи, Олимпийский проспект
6208	705	Зюзино, кв-л 36	Москва	Москва, Симферопольский бульвар
6210	706	Балаклавский просп., к.2 АБВ	Москва	Москва, Балаклавский проспект, 2А
