8600	1358	Дом на Студенческом	Московская область	Московская область, Ивантеевка, Студенческий проезд, 3
8601	1359	Тверская 30/32	Московская область	Московская область, Дубна, Тверская улица, 30/32
8602	1360	по ул. Тверская, 10	Московская область	Московская область, Дубна, Тверская улица, 10
8603	1361	Тверская 24	Московская область	Московская область, Дубна, Тверская улица, 24
8604	1362	Старый город	Московская область	Московская область, Шатура, Интернациональная улица, 16
8605	1363	Спасские ворота	Московская область	Московская область, Дмитров, улица Архитектора В.В. Белоброва
8606	1364	Киров Парк	Московская область	Московская область, Богородский городской округ, Ногинск, улица Кирова
8607	1365	Пятиречье	Московская область	Московская область, Дмитровский городской округ, посёлок городского типа Деденево, Заречная улица
8608	1366	Лермонтова 10	Московская область	Московская область, Королёв, улица Лермонтова, 10
8609	1367	Воря	Московская область	Московская область, Красноармейск, проспект Ленина
8610	1368	на ул. Урицкого	Московская область	Московская область, Дубна, улица Урицкого
8611	1369	Тверская 34/1	Московская область	Московская область, Дубна, Тверская улица, 34/1
8612	1370	Тверская 16	Московская область	Московская область, Дубна, Тверская улица, 16
8613	1371	Новая жизнь	Московская область	Московская область, Красноармейск, улица Новая Жизнь
8615	1372	Rastorguevo Village	Московская область	Московская область, Ленинский район, Видное, район Расторгуево, Сосновая улица, 15к2
8616	1373	Новый Эдем	Московская область	Московская область, городской округ Красногорск, деревня Гаврилково, жилой комплекс Эдем, улица 1-й Квартал, 6
8617	1374	Пролетарский проезд	Московская область	Московская область, городской округ Люберцы, посёлок городского типа Красково, 2-й Осоавиахимовский проезд, 12
8618	1375	Полет	Московская область	Московская область, Богородский городской округ, Ногинск, улица Дмитрия Михайлова
8620	1376	На Ильинском шоссе	Московская область	Московская область, городской округ Красногорск, посёлок Ильинское-Усово
8628	1377	Марьинский	Московская область	Московская область, Богородский городской округ, Электроугли, Пионерская улица
8629	1378	Зелёная околица	Московская область	Московская область, город Раменское, Крымская улица
8630	1379	Омега 2	Московская область	Московская область, Королёв, Спартаковская улица, 11
8631	1380	Новые клюшки	Московская область	Московская область, Электросталь, Спортивная улица
8632	1381	Молодая Купавна	Московская область	Московская область, Богородский городской округ, Старая Купавна, 1-я улица Разина
8633	1382	Новоселки	Московская область	Московская область, Ивантеевка, Хлебозаводская улица
8634	1383	Центральный	Московская область	Московская область, Лыткарино, улица Ленина
8635	1384	Первомайский	Московская область	Московская область, Лыткарино, Первомайская улица, 19
8636	1385	Звездный	Московская область	Московская область, Лыткарино, Первомайская улица
8637	1386	по ул. Гагарина, 28	Московская область	Московская область, Орехово-Зуево, улица Гагарина, 28
8638	1387	Южный-1	Московская область	Московская область, город Бронницы, микрорайон Южный-1, улица Соловьиная Роща
8639	1388	Барклай	Москва	Москва, улица Барклая, 7к4
8640	1389	Марьинский	Московская область	Московская область, город Бронницы, микрорайон Марьинский
8641	1390	Парковый	Московская область	Московская область, Котельники, улица Строителей
8642	1391	Ивановские дворики	Московская область	Московская область, Серпухов, микрорайон Ивановские Дворики
8643	1392	Столичный	Московская область	Московская область, Балашиха, микрорайон Железнодорожный, улица Калинина
8644	1393	в Куркино	Москва	Москва, Родионовская улица, 18
8647	1394	Супонево Life	Московская область	Московская область, Звенигород, микрорайон Супонево
8648	1395	Гавань	Московская область	Московская область, Дмитров, Ново-Рогачёвская улица
8649	1396	Стахановский	Московская область	Московская область, Электрогорск, улица Ухтомского, 21
8650	1397	Дмитрослав	Московская область	Московская область, Дмитров, Луговая улица
8651	1398	Хлебозаводская улица 43а	Московская область	Московская область, Ивантеевка, Хлебозаводская улица, 43а
8653	1399	Лесная сказка	Московская область	Московская область, Богородский городской округ, Ногинск, 7-я Черноголовская улица
8654	1400	Школьная 1 (Квартал 14)	Московская область	Московская область, Ивантеевка, Школьная улица, 1
8655	1401	Хлебозаводская 39а	Московская область	Московская область, Ивантеевка, Хлебозаводская улица 39А
8656	1402	Квартал 24	Московская область	Московская область, Дубна, проспект Боголюбова
8657	1403	Хлебозаводская 41а	Московская область	Московская область, Ивантеевка, Хлебозаводская 41а
8658	1404	на ул. Вернова	Московская область	Московская область, Дубна, улица Вернова
8659	1405	Новоселки 2	Московская область	Московская область, Ивантеевка, улица Новосёлки, 2
8660	1406	Новоселки 4	Московская область	Московская область, Ивантеевка, улица Новосёлки, 4
8661	1407	на ул. Пороховская 14	Московская область	Московская область, Волоколамск, ул. Пороховская 14
8662	1408	Новоселки Слободка 2	Московская область	Московская область, Ивантеевка, улица Новосёлки Слободка, 2
8663	1409	на ул. Чехова	Московская область	Московская область, Чехов, улица Чехова, 16
8664	1410	Созвездие	Московская область	Московская область, Звенигород, микрорайон Восточный, 3-й микрорайон
8665	1411	Новая Пресня	Москва	Москва, Причальный проезд, 8к1
8666	1412	Батарейный	Московская область	Московская область, Лобня, Батарейная улица, 8
8667	1413	Президентский	Московская область	Московская область, Лыткарино, улица Ухтомского
8674	1414	Прибрежный	Московская область	Московская область, Лыткарино, Колхозная улица
8678	1415	Хлебникоff	Московская область	Московская область, Ивантеевка, Хлебозаводская улица
8679	1416	Печатников 12	Москва	Москва, переулок Печатников, 12
8680	1417	Советник	Москва	Москва, улица Большая Дмитровка, 7/5с2
8681	1418	Stand Art	Москва	Москва, Страстной бульвар, 2
8682	1419	Мамонтовка	Московская область	Московская область, Пушкино, микрорайон Звягино, Школьная улица
8683	1420	Альтаир	Московская область	Московская область, Химки, Зелёная улица, 6к1
8687	1421	Парк на Фабричной	Московская область	Московская область, Раменское, Высоковольтная улица
8689	1422	Катуар	Московская область	Московская область, Дмитровский район, городское поселение Некрасовский, посёлок городского типа Некрасовский, Восточная улица
8690	1423	Клубный дом Bunin	Москва	Москва, улица Плющиха, 37/21
8691	1424	VAVILOVE	Москва	Москва, улица Вавилова, 69А
8692	1425	КутузовGRAD I	Москва	Москва, улица Петра Алексеева, 12
8694	1426	Пушкарь	Московская область	Московская область, Пушкинский район, село Тарасовка
8697	1427	Новая Пролетарка	Московская область	Московская область, Серпуховский район, поселок городского типа Пролетарский, Центральная улица, 37
8703	1428	Фили Парк	Москва	Москва, Багратионовский проезд, 1А
8704	1429	Ландыши	Москва	Москва, улица Саморы Машела
8716	1430	Поколение	Москва	Москва, Нововладыкинский проезд
8720	1431	Томилино	Московская область	Московская область, городской округ Люберцы, посёлок городского типа Томилино, Колхозная улица
8724	1432	Ледовская, участок 31	Московская область	Московская область, Домодедово, микрорайон Востряково, Ледовская улица
8725	1433	Патриарх	Москва	Москва, Малая Бронная улица, 44
8726	1434	Дипломат	Москва	Москва, Погорельский переулок, 6
8727	1435	Нежинский ковчег	Москва	Москва, Нежинская улица, 8к1
8728	1436	Хортус Гармония	Москва	Москва, Протопоповский переулок, 10
8729	1437	Жуковка Шале	Московская область	Московская область, Одинцовский район, сельское поселение Барвихинское, деревня Жуковка, 58
8730	1438	Колымажный 10	Москва	Москва, Колымажный переулок, 10
8731	1439	Ласточкино гнездо	Москва	Москва, Краснопролетарская улица, 7
8732	1440	Брюсов 19	Москва	Москва, Брюсов переулок, 19
8733	1441	Корона Эйр	Москва	Москва, проспект Вернадского, 92к1
8734	1442	Трианон	Москва	Москва, 3-я Красногвардейская улица, 3
8735	1443	Созвездие Капитал-2	Москва	Москва, улица Шаболовка, 10к1
8736	1444	Дворянское гнездо	Москва	Москва, Большой Лёвшинский переулок, 11
8737	1445	Помидор	Москва	Москва, Ленинградский проспект, 4
8738	1446	Смирновка	Московская область	Московская область, Солнечногорский район, посёлок Смирновка
8739	1447	Green House	Москва	Москва, улица Кутузова, 11к2
8740	1448	Остров Фантазий	Москва	Москва, Островной проезд, 7к1
8741	1449	Мастер и Маргарита	Москва	Москва, Малый Козихинский переулок, 3
8742	1450	Венский дом	Москва	Москва, 1-й Неопалимовский переулок, 8
8744	1451	Большой Палашевский 10	Москва	Москва, Большой Палашёвский переулок, 10
8745	1452	Тверской бульвар, 16	Москва	Москва, Тверской бульвар, 16с5
8746	1453	Новое Сватково	Московская область	Московская область, Старое Ярославское шоссе
8747	1454	Измайлово Lane	Москва	Москва, Борисовская улица, владение 4
8753	1455	Studio 12	Москва	Москва, 12-й проезд Марьиной Рощи
8754	1456	Байконур	Москва	Москва, улица Вавилова, 2/1
8756	1457	Зеленый бор (а также корпуса 2315А, Б)	Москва	Москва, Зеленоград, улица ЦНИИМОД
8760	1458	Каретный плаза	Москва	Москва, Большой Каретный переулок, 24с2
8763	1459	Марьина роща	Москва	Москва, 4-я улица Марьиной Рощи, 3
8766	1460	На Нижегородской	Москва	Москва, Нижегородская улица, 11А
8767	1461	Жилые дома в Зеленограде	Москва	Москва, Зеленоград, к2044
8768	1462	Усадьба Суханово	Московская область	Московская область, Ленинский район, деревня Суханово, жилой комплекс Усадьба Суханово
8769	1463	Федоскинская слобода	Московская область	Московская область, городской округ Мытищи, село Федоскино
8770	1464	Bolshevik	Москва	Москва, Ленинградский проспект, вл15с9
8771	1465	в Бескудниково	Москва	Москва, Дмитровское шоссе, 90к2
8772	1466	Первый Андреевский	Московская область	Московская область, Солнечногорский район, поселок городского типа Андреевка, Жилинская улица
8787	1467	Парк легенд	Москва	Москва, Южный административный округ, Даниловский район, квартал Парк Легенд
8788	1468	Янтарь Apartments	Москва	Москва, Левобережная улица, вл6Б
8789	1469	Нахимовский 21	Москва	Москва, Нахимовский проспект, вл21
8793	1470	Императорские Мытищи	Московская область	Московская область, городской округ Мытищи, жилой комплекс Императорские Мытищи, Тенистый бульвар
8795	1471	Ильинские луга	Московская область	Московская область, городской округ Красногорск, посёлок Ильинское-Усово, Заповедная улица
8796	1472	Отрада (2 очередь)	Московская область	Московская область, городской округ Красногорск, поселок Отрадное, Пятницкая улица
8797	1473	Резиденция на Покровском бульваре	Москва	Москва, Покровский бульвар, 5с1
8800	1474	Дом на Расковой	Московская область	Московская область, Электросталь, улица Расковой
8801	1475	на ул. Курочкина	Московская область	Московская область, городской округ Истра, Дедовск, улица имени Николая Курочкина, 1
8803	1476	на Октябрьском проспекте	Московская область	Московская область, Люберцы, Октябрьский проспект, 3
8804	1477	Атлетик Хаус	Московская область	Московская область, Люберцы, микрорайон Городок Б, улица 3-е Почтовое Отделение, 102
8805	1478	Дом на ул. 8 Марта	Московская область	Московская область, Люберцы, улица Шевлякова
8806	1479	Дом с фонтаном	Московская область	Московская область, Люберцы, 115-й квартал, улица Авиаторов, 15
8809	1480	Новый Ногинск	Московская область	Московская область, Богородский городской округ, Ногинск, улица Ильича
8810	1481	на Ленинском проспекте	Московская область	Московская область, Химки, Ленинский проспект
8813	1482	Новокрасково	Московская область	Московская область, городской округ Люберцы, посёлок городского типа Красково, Егорьевское шоссе
8817	1483	Level Кутузовский	Москва	Москва, улица Гришина
8818	1484	Коптево Park	Москва	Москва, Старокоптевский переулок, 8с8
8820	1485	Palazzo Imperiale	Москва	Москва, Щетининский переулок
8823	1486	Вавилова 4	Москва	Москва, улица Вавилова, 4
8825	1487	NEVA TOWERS	Москва	Москва, 1-ый Красногвардейский проезд
10179	1488	Sky Skolkovo	Московская область	Московская область, Одинцовский район, село Немчиновка, Овражная улица, 47
10231	1489	Немчиновка-Резиденц	Московская область	Московская область, Одинцовский район, село Немчиновка, Ольховая улица
10672	1490	Apart Otrada	Московская область	Московская область, городской округ Красногорск, посёлок Отрадное, Пятницкая улица, 5
11095	1491	Надежда	Московская область	Московская область, Ивантеевка, Студенческий проезд, 35
11101	1492	Первомайский	Московская область	Московская область, Ивантеевка, улица Дзержинского, вл4
11712	1493	Люберцы 2017	Московская область	Московская область, Люберцы, улица Дружбы
12107	1494	микрорайон Солнечный	Москва	Москва, Троицк, микрорайон Солнечный
12566	1495	Современник	Москва	Москва, Машкова улица, 13с1
12567	1496	Элитный дом Реномэ	Москва	Москва, Новослободская улица, 24
12967	1497	Клубная резиденция Ангелово	Московская область	Московская область, городской округ Красногорск, село Ангелово, жилой комплекс Ангелово-Резиденц
13168	1498	Купавна 2018	Московская область	Московская область, Богородский городской округ, Старая Купавна, улица Чехова, 4
13848	1499	Галерея ЗИЛ	Москва	Москва, Автозаводская улица, 23к7
13909	1500	Марусино-3	Московская область	Московская область, городской округ Люберцы, деревня Марусино, Заречная улица
13952	1501	Эко-Парк Вифанские пруды	Московская область	Московская область, Сергиев Посад, Фестивальная улица, 23с2
13989	1502	Новые Вешки	Московская область	Московская область, Мытищи городской округ, пос. Вешки, Новые Вешки кп, улица Лиственная
13993	1503	Тройка	Москва	Москва, Троицк, Городская улица, 20
14021	1504	Парк-тауэр	Московская область	Московская область, Химки, улица Бабакина, 15
14125	1505	Вега	Московская область	Московская область, Щелково, Щелково-3 мкр, улица Радиоцентр-5, 18к2
14169	1506	Солнечная аллея	Московская область	Московская область, Солнечногорский район, поселок городского типа Менделеево, улица Куйбышева
14220	1507	Благодар	Московская область	Московская область, Старая Шаховская дорога
14269	1508	Рупасовский	Московская область	Московская область, Мытищи, улица Воронина
14271	1509	Перловский	Московская область	Московская область, Мытищи, Трудовая улица, 6к3
14305	1510	Сердце Одинцово	Московская область	Московская область, Одинцово, 1-я Вокзальная улица
14358	1511	Любимое Домодедово	Московская область	Московская область, Домодедово, жилой комплекс Любимое Домодедово
14385	1512	Резиденция Тверская	Москва	Москва, 2-я Брестская улица, 6
14449	1513	Only	Москва	Москва, Заречная улица, 4Б
14452	1514	Солнечный (Щёлково)	Московская область	Московская область, Щёлково, Комсомольская улица, 18А
14464	1515	Пикассо	Москва	Москва, Мичуринский проспект
14521	1516	Саввино	Московская область	Московская область, Балашиха, Саввино мкр, улица Саввинская
14529	1517	на ул. 1-я Урицкая	Московская область	Московская область, Солнечногорск, 1-я Урицкая улица
14576	1518	Аристократ	Москва	Москва, улица Вересаева, 11
14625	1519	Дом на Почтовой	Московская область	Московская область, Звенигород, Почтовая улица, 1
14655	1520	Сорочаны	Московская область	Московская область, Дмитровский район, коттеджный поселок Сорочаны, Неизвестная улица
