1	1	Москвичка	Москва	Москва, поселение Сосенское, улица Василия Ощепкова
2	2	Марфино	Москва	Москва, Ботаническая улица, 11А
5	3	Versis	Москва	Москва, Нахимовский проспект, 73
6	4	Маршал	Москва	Москва, улица Маршала Рыбалко
8	5	Итальянский Квартал	Москва	Москва, улица Фадеева, 4А
9	6	Снегири Эко	Москва	Москва, Минская улица
36	7	Твой Адрес Мечты	Московская область	Московская область, Балашиха, Зелёная улица, 31
38	8	Ильинский парк	Московская область	Московская область, Красногорск, Ильинское шоссе
47	9	Розмарин	Москва	Москва, улица Наметкина, 18к2
56	10	Золотые ворота	Московская область	Московская область, Королёв, Пионерская улица
93	11	Кутузовский	Москва	Москва, Резервный проезд, 4
94	12	Академическая жемчужина	Москва	Москва, улица Дмитрия Ульянова, 6к1
111	13	Марсель	Москва	Москва, поселение Вороновское, деревня Никольское, улица Стольника Потёмкина
130	14	Садовые кварталы	Москва	Москва, улица Усачёва
132	15	Балтийский квартет	Москва	Москва, бульвар Яна Райниса, 31
134	16	Флотилия	Москва	Москва, Флотская улица
143	17	ФилиЧета	Москва	Москва, 2-я Филевская улица, 8
145	18	Новая Остоженка	Москва	Москва, 1-й Зачатьевский переулок
146	19	Дубровская Слобода	Москва	Москва, 1-я улица Машиностроения, 10
147	20	LIFE-Лазаревское	Москва	Москва, улица Адмирала Лазарева
149	21	Резидент 77	Москва	Москва, Алтуфьевское шоссе, 77к1
150	22	Богородский	Москва	Москва, бульвар Маршала Рокоссовского
228	23	Измайловский	Москва	Москва, Первомайская улица, 42
244	24	Авиатор-парк	Московская область	Московская область, Жуковский, улица Гудкова
256	25	Новая Апрелевка	Московская область	Московская область, Наро-Фоминский городской округ, Апрелевка, Парковая улица
275	26	Гагаринский	Московская область	Московская область, Балашиха, микрорайон Гагарина, 27
295	27	Заречье	Московская область	Московская область, Звенигород, Садовая улица
309	28	Орион	Московская область	Московская область, Мытищи, улица Колпакова
317	29	Смоленская Застава	Москва	Москва, Ружейный переулок, 3
319	30	Цветочный город	Московская область	Московская область, Мытищи, Магистральная улица
325	31	Вектор-хаус	Москва	Москва, улица Ивана Бабушкина, 10
328	32	Центральный проезд, 8	Московская область	Московская область, Ивантеевка, Центральный проезд, 17
339	33	Квартал «Спутник»	Московская область	Московская область, Мякининское шоссе
340	34	Квартал Тайнинский	Московская область	Московская область, Мытищи, Благовещенская улица
341	35	Каскад	Московская область	Московская область, Мытищи, Новомытищинский проспект, 41А
368	36	Sky House	Москва	Москва, Мытная улица
378	37	Приоритет	Москва	Москва, Нагорный бульвар
394	38	Виноградный	Москва	Москва, Измайловский проезд, 10
412	39	Примавера	Москва	Москва, Симферопольский проезд, 18
416	40	Кутузовская Ривьера	Москва	Москва, Нежинская улица
418	41	Таганское подворье	Москва	Москва, Нижегородская улица, 7
425	42	Новоясеневский	Москва	Москва, Новоясеневский проспект, 9
431	43	Арбатская слобода	Московская область	Московская область, Коломна, Москворецкая улица
433	44	Адмирал	Москва	Москва, Профсоюзная улица, 25к1
441	45	Николаевский дом	Москва	Москва, Комсомольский проспект, 9А
442	46	Knightsbridge Private Park	Москва	Москва, улица Ефремова, 19к1
452	47	VernadSKY	Москва	Москва, проспект Вернадского, у станции метро Юго-Западная
456	48	Manhattan House	Москва	Москва, улица Верхняя Масловка, 20С1
472	49	Центральный	Московская область	Московская область, Воскресенск, улица Куйбышева
475	50	Высоково	Московская область	Московская область, Электросталь, улица Захарченко
479	51	Дом на Гиляровского	Москва	Москва, улица Гиляровского, 55
487	52	Премьер	Москва	Москва, улица Фотиевой, 6к1
508	53	Новое Бисерово	Московская область	Московская область, Богородский городской округ, деревня Щемилово, улица Орлова
513	54	Первый	Московская область	Московская область, Одинцово, бульвар Маршала Крылова, 25А
515	55	Вокзальная 19	Московская область	Московская область, Одинцово, Вокзальная улица, 19
516	56	Одинцовский Парк	Московская область	Московская область, Одинцово, 9-й микрорайон, Белорусская улица
518	57	Сколков бор	Московская область	Московская область, Одинцовский район, пос. Заречье, улица Университетская
520	58	Дубки	Московская область	Московская область, Одинцовский район, поселок ВНИИССОК, Можайское шоссе
528	59	Лесной Городок	Московская область	Московская область, Одинцовский район, поселок городского типа Лесной Городок, Грибовская улица
530	60	Вяземский	Московская область	Московская область, Дмитровский район, коттеджный поселок ЖК Удино парк
533	61	Новоивановский	Московская область	Московская область, Одинцовский район, рабочий поселок Новоивановское, улица Агрохимиков, 19
573	62	Волжский	Москва	Москва, Волжский бульвар
575	63	ул. Дружбы, 35Б	Московская область	Московская область, Домодедово, микрорайон Дружба, улица Дружбы, 2
607	64	Княжьи горки	Московская область	Московская область, Павловский Посад, улица Герцена
619	65	Микрогород  В лесу	Московская область	Московская область, городской округ Красногорск, поселок Отрадное, Пятницкое шоссе
621	66	мкр. Архангельское	Московская область	Московская область, городской округ Красногорск, посёлок Архангельское, 7
655	67	Ренессанс	Московская область	Московская область, Подольск, Красногвардейский бульвар, 33А
680	68	Дирижабль	Москва	Москва, Профсоюзная улица, 64к2
681	69	Обыкновенное чудо	Москва	Москва, улица Пудовкина, 7
727	70	Румянцево-Парк	Москва	Москва, Родниковая улица
756	71	Loft Garden	Москва	Москва, 2-я Рыбинская улица, 13
757	72	LIFE-Сходненская	Москва	Москва, Химкинский бульвар
759	73	Авеню 77	Москва	Москва, микрорайон Северное Чертаново, 1Ак3
771	74	Витро Кантри	Московская область	Московская область, Одинцовский район, коттеджный посёлок Витро Кантри
783	75	Трио	Московская область	Московская область, Луховицы, улица Тимирязева, 12А
802	76	Barkli Park	Москва	Москва, улица Советской Армии, 6
827	77	Миниполис Самоцветы	Московская область	Московская область, Люберцы, улица Кирова
839	78	Янтарный город	Москва	Москва, улица Маршала Катукова
876	79	Клубный дом на Таганке	Москва	Москва, Брошевский переулок, 6с1
910	80	Дом на Трубецкой	Москва	Москва, Трубецкая улица, 10
918	81	Ривер-Хаус	Москва	Москва, Филёвский бульвар, 24к1
935	82	Город набережных	Московская область	Московская область, Химки, квартал Клязьма, улица Лётчика Ивана Фёдорова
964	83	Дом на Беговой	Москва	Москва, Хорошёвское шоссе, 12с1
975	84	Счастье в Олимпийской деревне	Москва	Москва, улица Мичуринский Проспект, Олимпийская Деревня, 10к1
986	85	Потапово	Московская область	Московская область, Щёлково, Чкаловская улица
1021	86	ул. Советская 18	Московская область	Московская область, Подольск, микрорайон Климовск, Советская улица
1024	87	Юрлово	Москва	Москва, Юрловский проезд, 14
1062	88	Дом в Сокольниках	Москва	Москва, Русаковская улица, 31
1070	89	Соколиная Гора	Москва	Москва, проспект Буденного
1082	90	Dominion	Москва	Москва, Ломоносовский проспект, 25
1085	91	O2XYGEN	Москва	Москва, Ярцевская улица, 27к1
1088	92	Академ-Палас	Москва	Москва, проспект Вернадского, вл78
1092	93	Ближняя дача	Москва	Москва, Староволынская улица, 15
1093	94	Волынский	Москва	Москва, Староволынская улица, 12к1
1094	95	Воробьевы Горы	Москва	Москва, Мосфильмовская улица, 70
1097	96	Дипломат	Москва	Москва, Мичуринский проспект, 39
1098	97	Долина грез	Москва	Москва, Крылатская улица
1099	98	Дом на Мосфильмовской	Москва	Москва, Мосфильмовская улица, 8
1101	99	Золотой Треугольник	Москва	Москва, улица Герасима Курина, 36
1102	100	Золотые Ключи 2	Москва	Москва, Минская улица
1107	101	Квартал Шуваловский	Москва	Москва, Ломоносовский проспект
1116	102	Мичуринский	Москва	Москва, жилой комплекс Мичуринский
1131	103	Солнце	Москва	Москва, Ельнинская улица 30
1172	104	Головино	Москва	Москва, Нарвская улица, 1Ак4
1173	105	Гранд-парк	Москва	Москва, Ходынский бульвар
1179	106	Петровский Парк	Москва	Москва, улица Верхняя Масловка, 25
1181	107	Триумф-Палас	Москва	Москва, Чапаевский переулок, 3
1212	108	Лайково	Московская область	Московская область, Одинцовский район, село Лайково
1215	109	Седьмое Небо	Москва	Москва, улица Академика Королева, 10
1237	110	Аэлита	Москва	Москва, Юровская улица, 94
1244	111	Континенталь	Москва	Москва, проспект Маршала Жукова, 78
1246	112	Лазурный Блюз	Москва	Москва, улица Твардовского
1248	113	Маршала Соколовского, 10	Москва	Москва, улица Маршала Соколовского, 10
1250	114	Олимпия	Москва	Москва, улица Исаковского, 39
1252	115	Покровский берег	Москва	Москва, Береговая улица
1253	116	Северная Звезда	Москва	Москва, улица Расплетина, 22к2
1254	117	Северный парк	Москва	Москва, Ленинградское шоссе, 25к3
1255	118	Соловьиная Роща	Москва	Москва, улица Соловьиная Роща, 16
1256	119	Эльсинор	Москва	Москва, улица Маршала Соколовского, 5
1280	120	Приволье	Москва	Москва, Привольная улица, 56
1287	121	Город-парк Переделкино Ближнее	Москва	Москва, поселение Внуковское, микрорайон Переделкино Ближнее
1289	122	Марушкино	Москва	Москва, поселение Марушкинское, деревня Марушкино, Северная улица, 15
1295	123	Триумф	Московская область	Московская область, Подольск, микрорайон Климовск, Советская улица
1297	124	Сосновка	Московская область	Московская область, Подольск, микрорайон Климовск, Больничный проезд
1298	125	Подольские просторы	Московская область	Московская область, Подольск, жилой комплекс Подольские просторы
1299	126	Московский (Красная Горка)	Московская область	Московская область, Подольск, Садовая улица
1300	127	Южный	Московская область	Московская область, Подольск, проезд Электромонтажный
1303	128	Родники	Московская область	Московская область, Подольский район, пос. Знамя Октября, улица Родники
1306	129	Красногорье DELUXE	Московская область	Московская область, Красногорск, микрорайон Павшинская Пойма, Павшинский бульвар, 40
1309	130	Опалиха О2	Московская область	Московская область, Красногорск, микрорайон Опалиха, улица Дежнева
1310	131	Новое Нахабино	Московская область	Московская область, Истринский район, Павло-Слободское сельское поселение, деревня Чёрная, Европейская улица
1314	132	Аристово-Митино	Московская область	Московская область, городской округ Красногорск, деревня Аристово, Весенняя улица
1316	133	Щитниково Изумрудный	Московская область	Московская область, Балашиха, квартал Янтарный, Кольцевая улица
1320	134	Сакраменто	Московская область	Московская область, Балашиха, микрорайон Сакраменто
1321	135	Акварели	Московская область	Московская область, Балашиха, проспект Ленина
1324	136	Новое Измайлово	Московская область	Московская область, Балашиха, жилой комплекс Новое Измайлово
1327	137	Новое Павлино	Московская область	Московская область, Балашиха, микрорайон Новое Павлино, Троицкая улица
1340	138	Академдом	Москва	Москва, улица Архитектора Власова, 8
1348	139	Клубный дом Brent	Москва	Москва, улица Вавилова, 54к4
1351	140	Бирюза	Москва	Москва, улица Гарибальди, 6к1
1354	141	Нахимово	Москва	Москва, Болотниковская улица, 36к4
1356	142	Потапово	Москва	Москва, Остафьевская улица, 43К17
1359	143	Светлый город	Москва	Москва, улица Академика Волгина
1363	144	Эмеральд	Москва	Москва, Ленинский проспект, 103
1380	145	Восточный	Московская область	Московская область, Лобня, проезд Свободный
1385	146	Мечта	Московская область	Московская область, Дмитровский район, сельское поселение Габовское, село Озерецкое
1387	147	Жемчужина Балашихи	Московская область	Московская область, Балашиха, жилой комплекс Жемчужина Балашихи
1389	148	Вавилов ДОМ	Москва	Москва, улица Вавилова
1391	149	Пестово	Московская область	Московская область, городской округ Мытищи, коттеджный поселок Пестово
1392	150	Лермонтовский	Московская область	Московская область, Люберцы, Октябрьский проспект, 1
1397	151	Красная Горка	Московская область	Московская область, Люберцы, микрорайон Красная Горка
1401	152	Аннинский	Москва	Москва, Варшавское шоссе, 160к1
1416	153	Скай Форт	Москва	Москва, жилой комплекс Скай Форт
1418	154	Коммунарка	Москва	Москва, посёлок Коммунарка
1421	155	Дубровка	Москва	Москва, поселение Сосенское, деревня Сосенки, Ясеневая улица
1422	156	Новотроицкий	Москва	Москва, поселок завода Мосрентген, 35
1424	157	Клубный	Московская область	Московская область, Ленинский район, Видное, ЖК Клубный
1426	158	Березовая роща	Московская область	Московская область, Видное, улица Березовая
1428	159	Завидное	Московская область	Московская область, Ленинский район, Видное, микрорайон Завидное
1429	160	Царицыно-2	Москва	Москва, 6-я Радиальная улица
1436	161	Загорье	Москва	Москва, Ягодная улица
1442	162	Ольховка-3	Московская область	Московская область, Ленинский район, посёлок Володарского, Текстильная улица
1446	163	Град Московский	Москва	Москва, Московский, микрорайон Град Московский
1447	164	Юго-Западный	Москва	Москва, Московский, 3-й микрорайон, 2
1448	165	Город-парк Первый Московский	Москва	Москва, Московский, улица Бианки
1455	166	Мичуринский квартал	Московская область	Московская область, Химки, микрорайон Сходня, улица Мичурина
1459	167	Левобережный	Московская область	Московская область, Химки, Совхозная улица
1465	168	Почтовая 41к2	Московская область	Московская область, Звенигород, Почтовая улица, 41к2
1466	169	Серебряные звоны	Московская область	Московская область, Звенигород, улица Макарова
1471	170	Гусарская баллада	Московская область	Московская область, Одинцово, Триумфальная улица
1473	171	Да Винчи	Московская область	Московская область, Одинцово, жилой комплекс Да Винчи
1487	172	Ваш клубный дом	Москва	Москва, 1-й Зачатьевский переулок, 8с3
1489	173	Дом на Селезневской	Москва	Москва, Селезневская улица
1494	174	Smolensky De Luxe	Москва	Москва, 1-й Смоленский переулок, 21
1500	175	Barkli Plaza	Москва	Москва, Пречистенская набережная, 17
1501	176	Барыковские палаты	Москва	Москва, Барыковский переулок, 6
1502	177	Башня Федерация	Москва	Москва, Пресненская набережная, 12
1505	178	Дом на Покровском бульваре	Москва	Москва, Казарменный переулок, 3
1506	179	Edison House	Москва	Москва, Электрический переулок, 10с1
1508	180	Дом на Таганке	Москва	Москва, улица Талалихина, 8
1515	181	Коперник	Москва	Москва, улица Большая Якиманка, 22к3
1516	182	Легенда Цветного	Москва	Москва, Цветной бульвар, 2
1524	183	Онегин	Москва	Москва, улица Малая Полянка, 2
1525	184	Петровъ Дом	Москва	Москва, Дмитровский переулок, 7
1534	185	Салтыковка Престиж	Московская область	Московская область, Балашиха, микрорайон Салтыковка, жилой комплекс Салтыковка Престиж
1539	186	Посольский дом	Москва	Москва, Борисоглебский переулок, 13С3
1544	187	Тверской	Москва	Москва, 3-я Тверская-Ямская улица, 10
1546	188	Трилогия	Москва	Москва, улица Трехгорный Вал, 14С1
1550	189	Шоколад	Москва	Москва, Тетеринский переулок, 18с2
1554	190	Резиденция Чистые Пруды	Москва	Москва, Подсосенский переулок, 3
1555	191	Клубный дом на Арбате	Москва	Москва, Староконюшенный переулок, 45
1575	192	Балашиха-парк	Московская область	Московская область, Балашиха, Трубецкая улица, 102
1579	193	Радужный	Московская область	Московская область, Воскресенск, микрорайон Лопатинский, Юбилейный переулок, 8
1581	194	Сосновый бор	Московская область	Московская область, городской округ Люберцы, посёлок городского типа Октябрьский, микрорайон Сосновый Бор
